{
  "prospect_id": "alex_chen_softeng",
  "outreach_stage": "engaged",
  "messages": [
    {
      "sender": "operator",
      "text": "Hey Alex — your post on event-driven architecture at Stripe was great. I'm Nova from Embedding VC, we back early-stage AI startups and connect top talent. Open to exploring?",
      "timestamp": "2026-03-24T10:00:00Z",
      "sequence_step": 1,
      "attachments": []
    },
    {
      "sender": "prospect",
      "text": "Thanks Nova! Yeah I'm always curious what's out there.",
      "timestamp": "2026-03-25T09:15:00Z",
      "sequence_step": null,
      "attachments": []
    },
    {
      "sender": "operator",
      "text": "Your jump from Google to Stripe is fascinating. What's been keeping you most engaged lately?",
      "timestamp": "2026-03-25T14:00:00Z",
      "sequence_step": 2,
      "attachments": []
    }
  ],
  "last_action": "send_followup_message",
  "last_action_timestamp": "2026-03-25T14:00:00Z",
  "next_action": "send_followup_message",
  "next_action_after": null,
  "planned_message": null,
  "connection_note": "Hey Alex — your post on event-driven architecture at Stripe was great. I'm Nova from Embedding VC, we back early-stage AI startups and connect top talent. Open to exploring?",
  "resume_path": null,
  "email": null,
  "meeting_link": null,
  "ended_at": null,
  "ended_reason": null,
  "report_path": null,
  "sequence_step": 2,
  "stage_history": [
    { "stage": "cold", "entered_at": "2026-03-24T00:00:00Z", "reason": "prospect added to queue" },
    { "stage": "pending_connection", "entered_at": "2026-03-24T10:00:00Z", "reason": "connection request sent" },
    { "stage": "engaged", "entered_at": "2026-03-24T10:01:00Z", "reason": "connection accepted" }
  ]
}
