{
  "prospect_id": "alex_chen_softeng",
  "outreach_stage": "engaged",
  "messages": [
    {
      "sender": "prospect",
      "text": "[MOCK] Thanks for connecting!",
      "timestamp": "2026-04-10T10:00:00Z"
    },
    {
      "sender": "operator",
      "text": "[MOCK] Great to connect — excited to stay in touch.",
      "timestamp": "2026-04-10T11:00:00Z"
    },
    {
      "sender": "operator",
      "text": "Alex, that payment service migration sounds like serious work — event-driven at Stripe scale is no joke. What's been occupying most of your attention since it shipped? Still deep in payments infrastructure, or has your focus shifted to something new?",
      "timestamp": "2026-04-12T00:00:00Z"
    }
  ],
  "last_action": "send_followup_message",
  "last_action_timestamp": "2026-04-12T00:00:00Z",
  "next_action": null,
  "next_action_after": null,
  "planned_message": null,
  "connection_note": null,
  "resume_path": null,
  "email": null,
  "meeting_link": null,
  "ended_at": null,
  "ended_reason": null,
  "report_path": null,
  "sequence_step": 2,
  "stage_history": [
    { "stage": "cold", "entered_at": "2026-03-24T00:00:00Z", "reason": "prospect added to queue" },
    { "stage": "pending_connection", "entered_at": "2026-04-09T09:00:00Z", "reason": "connection request sent" },
    { "stage": "engaged", "entered_at": "2026-04-10T10:00:00Z", "reason": "prospect replied to connection request" },
    { "stage": "engaged", "entered_at": "2026-04-12T00:00:00Z", "reason": "step 2 career deep-dive sent" }
  ]
}
