{
  "prospect_id": "alex_chen_softeng",
  "outreach_stage": "replied",
  "messages": [
    {
      "sender": "operator",
      "text": "Hey Alex — saw your post on event-driven architecture at Stripe. We back early-stage AI startups at Embedding VC and are always looking to connect strong distributed-systems engineers with great teams. Would you be open to exploring?",
      "timestamp": "2026-03-20T10:00:00Z",
      "sequence_step": 1,
      "attachments": []
    },
    {
      "sender": "prospect",
      "text": "Thanks! Happy to connect. What kind of role are you hiring for?",
      "timestamp": "2026-03-21T14:32:00Z",
      "sequence_step": null,
      "attachments": []
    }
  ],
  "last_action": "send_connection_request",
  "last_action_timestamp": "2026-03-20T10:00:00Z",
  "next_action": "send_followup_message",
  "next_action_after": "2026-03-21T14:32:00Z",
  "planned_message": null,
  "connection_note": "Hey Alex — saw your post on event-driven architecture at Stripe. We back early-stage AI startups at Embedding VC and are always looking to connect strong distributed-systems engineers with great teams. Would you be open to exploring?",
  "resume_path": null,
  "email": null,
  "meeting_link": null,
  "ended_at": null,
  "ended_reason": null,
  "report_path": null,
  "sequence_step": 1,
  "stage_history": [
    { "stage": "cold",               "entered_at": "2026-03-20T00:00:00Z", "reason": "prospect added to queue" },
    { "stage": "pending_connection", "entered_at": "2026-03-20T10:00:00Z", "reason": "connection request sent" },
    { "stage": "engaged",            "entered_at": "2026-03-20T10:01:00Z", "reason": "connection accepted" },
    { "stage": "replied",            "entered_at": "2026-03-21T14:32:00Z", "reason": "prospect replied positively" }
  ]
}
