{
  "prospect_id": "alex_chen_softeng",
  "outreach_stage": "replied",
  "messages": [
    {
      "sender": "operator",
      "text": "Hey Alex — your post on event-driven architecture at Stripe was great. I'm Nova from Embedding VC, we back early-stage AI startups and connect top talent. Open to exploring?",
      "timestamp": "2026-03-24T10:00:00Z",
      "sequence_step": 1,
      "attachments": []
    },
    {
      "sender": "prospect",
      "text": "Thanks Nova! Yeah I'm always curious what's out there.",
      "timestamp": "2026-03-25T09:15:00Z",
      "sequence_step": null,
      "attachments": []
    },
    {
      "sender": "operator",
      "text": "Your jump from Google to Stripe is fascinating. What drew you to payments infra, and what's been keeping you most engaged lately?",
      "timestamp": "2026-03-25T14:00:00Z",
      "sequence_step": 2,
      "attachments": []
    },
    {
      "sender": "prospect",
      "text": "Honestly I love the scale problems at Stripe but I've been itching to work on something earlier stage. Been looking at some ML infra teams.",
      "timestamp": "2026-03-26T11:30:00Z",
      "sequence_step": null,
      "attachments": []
    },
    {
      "sender": "operator",
      "text": "The 0-to-1 itch is real. With your distributed systems chops and interest in ML infra, are you leaning toward joining an early startup or thinking about building something yourself?",
      "timestamp": "2026-03-26T16:00:00Z",
      "sequence_step": 3,
      "attachments": []
    },
    {
      "sender": "prospect",
      "text": "Joining for now — I want to learn the ML side more before starting something. Ideally a Series A company where I can own a big chunk of the infra. Definitely open to hearing about what's in your network.",
      "timestamp": "2026-03-27T10:00:00Z",
      "sequence_step": null,
      "attachments": []
    }
  ],
  "last_action": "send_followup_message",
  "last_action_timestamp": "2026-03-26T16:00:00Z",
  "next_action": "send_followup_message",
  "next_action_after": null,
  "planned_message": null,
  "connection_note": "Hey Alex — your post on event-driven architecture at Stripe was great. I'm Nova from Embedding VC, we back early-stage AI startups and connect top talent. Open to exploring?",
  "resume_path": null,
  "email": null,
  "meeting_link": null,
  "ended_at": null,
  "ended_reason": null,
  "report_path": null,
  "sequence_step": 3,
  "stage_history": [
    { "stage": "cold", "entered_at": "2026-03-24T00:00:00Z", "reason": "prospect added to queue" },
    { "stage": "pending_connection", "entered_at": "2026-03-24T10:00:00Z", "reason": "connection request sent" },
    { "stage": "engaged", "entered_at": "2026-03-24T10:01:00Z", "reason": "connection accepted" },
    { "stage": "replied", "entered_at": "2026-03-25T09:15:00Z", "reason": "prospect replied positively" }
  ]
}
